{
  "id": "inf1250-m2-dd",
  "module": "M2",
  "tp": "TP2",
  "drill_type": "D",
  "prompt": "Compare algorithm sketches by growth behavior.",
  "expected_action": "State which scales better and why.",
  "evaluation_rule": "Correct growth-rate reasoning used.",
  "items": [
    {
      "id": "i1",
      "stem": "Single loop over n items vs nested loops over n items."
    },
    {
      "id": "i2",
      "stem": "Direct lookup vs scanning a list."
    },
    {
      "id": "i3",
      "stem": "Doubling input size in a linear algorithm."
    },
    {
      "id": "i4",
      "stem": "Doubling input size in a quadratic algorithm."
    }
  ],
  "meta": {
    "version": "0.1.0",
    "created": "2026-01-06",
    "last_updated": "2026-01-06",
    "source": "INF1250 M2 drills (TP2)",
    "notes": "Generated via cbia-builder workflow"
  }
}