{
  "id": "inf1250-m2-dc",
  "module": "M2",
  "tp": "TP2",
  "drill_type": "C",
  "prompt": "Mark inputs, outputs, and state variables.",
  "expected_action": "List inputs, outputs, and state explicitly.",
  "evaluation_rule": "All stateful elements correctly identified.",
  "items": [
    {
      "id": "i1",
      "stem": "Validate a password and return success or failure."
    },
    {
      "id": "i2",
      "stem": "Compute the average of numbers."
    },
    {
      "id": "i3",
      "stem": "Track the maximum value seen so far."
    },
    {
      "id": "i4",
      "stem": "Load configuration and initialize the program."
    }
  ],
  "meta": {
    "version": "0.1.0",
    "created": "2026-01-06",
    "last_updated": "2026-01-06",
    "source": "INF1250 M2 drills (TP2)",
    "notes": "Generated via cbia-builder workflow"
  }
}