{
  "id": "inf1250-m2-da",
  "module": "M2",
  "tp": "TP2",
  "drill_type": "A",
  "prompt": "Identify the dominant control primitive and whether abstraction is present.",
  "expected_action": "Label each stem with {sequence|selection|iteration} and abstraction yes/no.",
  "evaluation_rule": "Correct primitive identified; abstraction marked only if a clear boundary exists.",
  "items": [
    {
      "id": "i1",
      "stem": "Read two numbers and print their sum."
    },
    {
      "id": "i2",
      "stem": "If input is invalid, show an error; otherwise continue."
    },
    {
      "id": "i3",
      "stem": "Repeat input until it satisfies a condition."
    },
    {
      "id": "i4",
      "stem": "Call a helper function and branch on its return value."
    }
  ],
  "meta": {
    "version": "0.1.0",
    "created": "2026-01-06",
    "last_updated": "2026-01-06",
    "source": "INF1250 M2 drills (TP2)",
    "notes": "Generated via cbia-builder workflow"
  }
}